SQL> create view v_customer as select * from customer;

View created.

SQL> desc v_customer;
 Name                                      Null?    Type
 ----------------------------------------- -------- ----------------------------
 CUSTOMER_ID                               NOT NULL VARCHAR2(20)
 FNAME                                              VARCHAR2(10)
 MNAME                                              VARCHAR2(10)
 LNAME                                              VARCHAR2(10)
 CITY                                               VARCHAR2(20)
 PHONE_NUMBER                                       NUMBER(10)
 OCCUPATION                                         VARCHAR2(20)
 DOB                                                DATE
 BALANCE                                            NUMBER(10,2)

SQL> select * from v_customer;

CUSTOMER_ID          FNAME      MNAME      LNAME      CITY
-------------------- ---------- ---------- ---------- --------------------
PHONE_NUMBER OCCUPATION           DOB          BALANCE
------------ -------------------- --------- ----------
c1110                Ranjeni    Chandra    Sekar      Avadi
  9042855939 Student              07-APR-06    40125.7

c1230                Jeni       Shiva      Kumar      Chromepet
  9877712888 Teacher              29-FEB-04       1000

c2234                Arul       Bala       Kumar      Saidapet
  9966623555 Youtuber             31-JAN-05    3000.15


CUSTOMER_ID          FNAME      MNAME      LNAME      CITY
-------------------- ---------- ---------- ---------- --------------------
PHONE_NUMBER OCCUPATION           DOB          BALANCE
------------ -------------------- --------- ----------
da991                Bharathi   Raja       Vel        Cuddalore
  8899970000 Entreprenuer         05-AUG-05   10115.71

557b                 Hasin      Taj        Shadik     Kallakurichi
  9122287555 Software engineer    09-MAY-95       5.71

34br                 Hari       Haran      K          Annanur
  7855534999 Doctor               15-JUL-89   50000.71


CUSTOMER_ID          FNAME      MNAME      LNAME      CITY
-------------------- ---------- ---------- ---------- --------------------
PHONE_NUMBER OCCUPATION           DOB          BALANCE
------------ -------------------- --------- ----------
c9999                Sri        Mano       A          Kanyakumari
   904266689 Police               01-JAN-00     500.51

da888                Arul       Mozhi      Varman     Sivagangai
  9999966666 Shop owner           19-DEC-79    10078.9

op900                           Haran      K          Annanur
  7855534999 Doctor               15-JUL-89   50000.71


CUSTOMER_ID          FNAME      MNAME      LNAME      CITY
-------------------- ---------- ---------- ---------- --------------------
PHONE_NUMBER OCCUPATION           DOB          BALANCE
------------ -------------------- --------- ----------
dl909                Mohammed   Asil       Mustafa    Alwarpet
  9045678666 Conductor            08-SEP-92    90000.9

dsm90                Geetha     Rama       Narayanan  Nungambakkam
  9840509942 Professor            26-OCT-75      25000

lm889                Hema       Latha      R          Tirutani
  9744423555 Chemical Engineer    31-MAR-79      25000


CUSTOMER_ID          FNAME      MNAME      LNAME      CITY
-------------------- ---------- ---------- ---------- --------------------
PHONE_NUMBER OCCUPATION           DOB          BALANCE
------------ -------------------- --------- ----------
al976                Kavin      Bharath    G          Delhi
  9688856222 Data Scientist       28-MAR-99     5001.2

in064                Nithya     Prakash    S          Mumbai
  9941185593 Data Analist         06-SEP-98   100000.6

mn905                Theja      Sree       R          Avadi
  9840509932 Travel guide         02-FEB-05       78.9


15 rows selected.

SQL> set linesize 150;
SQL> select * from v_customer;

CUSTOMER_ID          FNAME      MNAME      LNAME      CITY                 PHONE_NUMBER OCCUPATION           DOB          BALANCE
-------------------- ---------- ---------- ---------- -------------------- ------------ -------------------- --------- ----------
c1110                Ranjeni    Chandra    Sekar      Avadi                  9042855939 Student              07-APR-06    40125.7
c1230                Jeni       Shiva      Kumar      Chromepet              9877712888 Teacher              29-FEB-04       1000
c2234                Arul       Bala       Kumar      Saidapet               9966623555 Youtuber             31-JAN-05    3000.15
da991                Bharathi   Raja       Vel        Cuddalore              8899970000 Entreprenuer         05-AUG-05   10115.71
557b                 Hasin      Taj        Shadik     Kallakurichi           9122287555 Software engineer    09-MAY-95       5.71
34br                 Hari       Haran      K          Annanur                7855534999 Doctor               15-JUL-89   50000.71
c9999                Sri        Mano       A          Kanyakumari             904266689 Police               01-JAN-00     500.51
da888                Arul       Mozhi      Varman     Sivagangai             9999966666 Shop owner           19-DEC-79    10078.9
op900                           Haran      K          Annanur                7855534999 Doctor               15-JUL-89   50000.71
dl909                Mohammed   Asil       Mustafa    Alwarpet               9045678666 Conductor            08-SEP-92    90000.9
dsm90                Geetha     Rama       Narayanan  Nungambakkam           9840509942 Professor            26-OCT-75      25000

CUSTOMER_ID          FNAME      MNAME      LNAME      CITY                 PHONE_NUMBER OCCUPATION           DOB          BALANCE
-------------------- ---------- ---------- ---------- -------------------- ------------ -------------------- --------- ----------
lm889                Hema       Latha      R          Tirutani               9744423555 Chemical Engineer    31-MAR-79      25000
al976                Kavin      Bharath    G          Delhi                  9688856222 Data Scientist       28-MAR-99     5001.2
in064                Nithya     Prakash    S          Mumbai                 9941185593 Data Analist         06-SEP-98   100000.6
mn905                Theja      Sree       R          Avadi                  9840509932 Travel guide         02-FEB-05       78.9

15 rows selected.

SQL> insert into v_customer values('cr905','Rohith','Chandra','Sekar','Avadi','9941185666','Student','04-SEP-2008',1.00);

1 row created.

Commit complete.
SQL> select * from v_customer;

CUSTOMER_ID          FNAME      MNAME      LNAME      CITY                 PHONE_NUMBER OCCUPATION           DOB          BALANCE
-------------------- ---------- ---------- ---------- -------------------- ------------ -------------------- --------- ----------
cr905                Rohith     Chandra    Sekar      Avadi                  9941185666 Student              04-SEP-08          1
c1110                Ranjeni    Chandra    Sekar      Avadi                  9042855939 Student              07-APR-06    40125.7
c1230                Jeni       Shiva      Kumar      Chromepet              9877712888 Teacher              29-FEB-04       1000
c2234                Arul       Bala       Kumar      Saidapet               9966623555 Youtuber             31-JAN-05    3000.15
da991                Bharathi   Raja       Vel        Cuddalore              8899970000 Entreprenuer         05-AUG-05   10115.71
557b                 Hasin      Taj        Shadik     Kallakurichi           9122287555 Software engineer    09-MAY-95       5.71
34br                 Hari       Haran      K          Annanur                7855534999 Doctor               15-JUL-89   50000.71
c9999                Sri        Mano       A          Kanyakumari             904266689 Police               01-JAN-00     500.51
da888                Arul       Mozhi      Varman     Sivagangai             9999966666 Shop owner           19-DEC-79    10078.9
op900                           Haran      K          Annanur                7855534999 Doctor               15-JUL-89   50000.71
dl909                Mohammed   Asil       Mustafa    Alwarpet               9045678666 Conductor            08-SEP-92    90000.9

CUSTOMER_ID          FNAME      MNAME      LNAME      CITY                 PHONE_NUMBER OCCUPATION           DOB          BALANCE
-------------------- ---------- ---------- ---------- -------------------- ------------ -------------------- --------- ----------
dsm90                Geetha     Rama       Narayanan  Nungambakkam           9840509942 Professor            26-OCT-75      25000
lm889                Hema       Latha      R          Tirutani               9744423555 Chemical Engineer    31-MAR-79      25000
al976                Kavin      Bharath    G          Delhi                  9688856222 Data Scientist       28-MAR-99     5001.2
in064                Nithya     Prakash    S          Mumbai                 9941185593 Data Analist         06-SEP-98   100000.6
mn905                Theja      Sree       R          Avadi                  9840509932 Travel guide         02-FEB-05       78.9

16 rows selected.

SQL> select * from customer;

CUSTOMER_ID          FNAME      MNAME      LNAME      CITY                 PHONE_NUMBER OCCUPATION           DOB          BALANCE
-------------------- ---------- ---------- ---------- -------------------- ------------ -------------------- --------- ----------
cr905                Rohith     Chandra    Sekar      Avadi                  9941185666 Student              04-SEP-08          1
c1110                Ranjeni    Chandra    Sekar      Avadi                  9042855939 Student              07-APR-06    40125.7
c1230                Jeni       Shiva      Kumar      Chromepet              9877712888 Teacher              29-FEB-04       1000
c2234                Arul       Bala       Kumar      Saidapet               9966623555 Youtuber             31-JAN-05    3000.15
da991                Bharathi   Raja       Vel        Cuddalore              8899970000 Entreprenuer         05-AUG-05   10115.71
557b                 Hasin      Taj        Shadik     Kallakurichi           9122287555 Software engineer    09-MAY-95       5.71
34br                 Hari       Haran      K          Annanur                7855534999 Doctor               15-JUL-89   50000.71
c9999                Sri        Mano       A          Kanyakumari             904266689 Police               01-JAN-00     500.51
da888                Arul       Mozhi      Varman     Sivagangai             9999966666 Shop owner           19-DEC-79    10078.9
op900                           Haran      K          Annanur                7855534999 Doctor               15-JUL-89   50000.71
dl909                Mohammed   Asil       Mustafa    Alwarpet               9045678666 Conductor            08-SEP-92    90000.9

CUSTOMER_ID          FNAME      MNAME      LNAME      CITY                 PHONE_NUMBER OCCUPATION           DOB          BALANCE
-------------------- ---------- ---------- ---------- -------------------- ------------ -------------------- --------- ----------
dsm90                Geetha     Rama       Narayanan  Nungambakkam           9840509942 Professor            26-OCT-75      25000
lm889                Hema       Latha      R          Tirutani               9744423555 Chemical Engineer    31-MAR-79      25000
al976                Kavin      Bharath    G          Delhi                  9688856222 Data Scientist       28-MAR-99     5001.2
in064                Nithya     Prakash    S          Mumbai                 9941185593 Data Analist         06-SEP-98   100000.6
mn905                Theja      Sree       R          Avadi                  9840509932 Travel guide         02-FEB-05       78.9

16 rows selected.

SQL> update v_customer set balance+=100 where customer_id='dsm90';
update v_customer set balance+=100 where customer_id='dsm90'
                             *
ERROR at line 1:
ORA-00927: missing equal sign


SQL> update v_customer set balance=balance+100 where customer_id='dsm90';

1 row updated.

Commit complete.
SQL> select * from v_customer;

CUSTOMER_ID          FNAME      MNAME      LNAME      CITY                 PHONE_NUMBER OCCUPATION           DOB          BALANCE
-------------------- ---------- ---------- ---------- -------------------- ------------ -------------------- --------- ----------
cr905                Rohith     Chandra    Sekar      Avadi                  9941185666 Student              04-SEP-08          1
c1110                Ranjeni    Chandra    Sekar      Avadi                  9042855939 Student              07-APR-06    40125.7
c1230                Jeni       Shiva      Kumar      Chromepet              9877712888 Teacher              29-FEB-04       1000
c2234                Arul       Bala       Kumar      Saidapet               9966623555 Youtuber             31-JAN-05    3000.15
da991                Bharathi   Raja       Vel        Cuddalore              8899970000 Entreprenuer         05-AUG-05   10115.71
557b                 Hasin      Taj        Shadik     Kallakurichi           9122287555 Software engineer    09-MAY-95       5.71
34br                 Hari       Haran      K          Annanur                7855534999 Doctor               15-JUL-89   50000.71
c9999                Sri        Mano       A          Kanyakumari             904266689 Police               01-JAN-00     500.51
da888                Arul       Mozhi      Varman     Sivagangai             9999966666 Shop owner           19-DEC-79    10078.9
op900                           Haran      K          Annanur                7855534999 Doctor               15-JUL-89   50000.71
dl909                Mohammed   Asil       Mustafa    Alwarpet               9045678666 Conductor            08-SEP-92    90000.9

CUSTOMER_ID          FNAME      MNAME      LNAME      CITY                 PHONE_NUMBER OCCUPATION           DOB          BALANCE
-------------------- ---------- ---------- ---------- -------------------- ------------ -------------------- --------- ----------
dsm90                Geetha     Rama       Narayanan  Nungambakkam           9840509942 Professor            26-OCT-75      25100
lm889                Hema       Latha      R          Tirutani               9744423555 Chemical Engineer    31-MAR-79      25000
al976                Kavin      Bharath    G          Delhi                  9688856222 Data Scientist       28-MAR-99     5001.2
in064                Nithya     Prakash    S          Mumbai                 9941185593 Data Analist         06-SEP-98   100000.6
mn905                Theja      Sree       R          Avadi                  9840509932 Travel guide         02-FEB-05       78.9

16 rows selected.

SQL> delete * from v_customer where balance<10000;
delete * from v_customer where balance<10000
       *
ERROR at line 1:
ORA-00903: invalid table name


SQL> delete from v_customer where balance<10000;

7 rows deleted.

Commit complete.
SQL> select * from v_customer;

CUSTOMER_ID          FNAME      MNAME      LNAME      CITY                 PHONE_NUMBER OCCUPATION           DOB          BALANCE
-------------------- ---------- ---------- ---------- -------------------- ------------ -------------------- --------- ----------
c1110                Ranjeni    Chandra    Sekar      Avadi                  9042855939 Student              07-APR-06    40125.7
da991                Bharathi   Raja       Vel        Cuddalore              8899970000 Entreprenuer         05-AUG-05   10115.71
34br                 Hari       Haran      K          Annanur                7855534999 Doctor               15-JUL-89   50000.71
da888                Arul       Mozhi      Varman     Sivagangai             9999966666 Shop owner           19-DEC-79    10078.9
op900                           Haran      K          Annanur                7855534999 Doctor               15-JUL-89   50000.71
dl909                Mohammed   Asil       Mustafa    Alwarpet               9045678666 Conductor            08-SEP-92    90000.9
dsm90                Geetha     Rama       Narayanan  Nungambakkam           9840509942 Professor            26-OCT-75      25100
lm889                Hema       Latha      R          Tirutani               9744423555 Chemical Engineer    31-MAR-79      25000
in064                Nithya     Prakash    S          Mumbai                 9941185593 Data Analist         06-SEP-98   100000.6

9 rows selected.

SQL> select * from branch;

BRANCH_ID            BRANCH_NAME          BRANCH_CODE          ADDRESS              PHONE_NUMBER     AMOUNT
-------------------- -------------------- -------------------- -------------------- ------------ ----------
C1000                Avadi                1                    No:24__lazar nagar     9876543210
C1001                Ambattur             2                    No:25__shenoy nagar    1122334455
C1002                Annanur              3                    No:26__ram nagar       2233445566
C1003                Tirumullaivoil       1001                 No:27__rani nagar      3344556677
C1004                Pattravakkam         1002                 No:28__Shyam nagar     4455667788
C1005                Korattur             1003                 No:29__JGVV nagar      5566778899
C1006                Villivakkam          1004                 No:30__Bharath nagar   6677889900
C1007                Perambur             1005                 No:31__gk colony       7788990011
C1008                Villivakam           1006                 No:32__mn villa        8899001112
C1009                Korattur             1007                 No:33__sweet villa     9900111222
D20011               Tirumullaivaoil      1008                 No:34__white villa       11122233

BRANCH_ID            BRANCH_NAME          BRANCH_CODE          ADDRESS              PHONE_NUMBER     AMOUNT
-------------------- -------------------- -------------------- -------------------- ------------ ----------
D20012               Mambalam             1009                 No:39__kk nagar        1112223334
D20013               Annanur              2000                 No:36__kalam nagar     2233344455
D20014               Ambattur             2001                 No:37__sri nagar       3334445556
D20015               Avadi                2002                 No:38__Ok nagar        3444555666

15 rows selected.

SQL> create view v_branch as select branch_id,branch_code,phone_number from branch;

View created.

SQL> select * from v_branch;

BRANCH_ID            BRANCH_CODE          PHONE_NUMBER
-------------------- -------------------- ------------
C1000                1                      9876543210
C1001                2                      1122334455
C1002                3                      2233445566
C1003                1001                   3344556677
C1004                1002                   4455667788
C1005                1003                   5566778899
C1006                1004                   6677889900
C1007                1005                   7788990011
C1008                1006                   8899001112
C1009                1007                   9900111222
D20011               1008                     11122233

BRANCH_ID            BRANCH_CODE          PHONE_NUMBER
-------------------- -------------------- ------------
D20012               1009                   1112223334
D20013               2000                   2233344455
D20014               2001                   3334445556
D20015               2002                   3444555666

15 rows selected.

SQL> insert into v_branch values('D20016',2003,9999999999);

1 row created.

Commit complete.
SQL> update v_branch set branch_code=1010 where branch_id='D20012';

1 row updated.

Commit complete.
SQL> delete from v_branch where branch_code between 1001 and 1009;

8 rows deleted.

Commit complete.
SQL> select * from v_branch;

BRANCH_ID            BRANCH_CODE          PHONE_NUMBER
-------------------- -------------------- ------------
C1000                1                      9876543210
C1001                2                      1122334455
C1002                3                      2233445566
D20012               1010                   1112223334
D20013               2000                   2233344455
D20014               2001                   3334445556
D20015               2002                   3444555666
D20016               2003                   9999999999

8 rows selected.

SQL> select * from loan_payment;

LOAN_PAYMENT_ID      PAYMENT_S PRINCIPAL_AMOUNT INTEREST_AMOUNT PAID_AMOUNT PAID_DATE
-------------------- --------- ---------------- --------------- ----------- ---------
AH207                04-APR-05            10000            1000       93000 04-APR-05
AH208                04-APR-05             9000            2000       13000 05-APR-05
AH209                04-APR-06             8000            3000       12000 05-APR-06
AH300                04-MAY-06             7200            4000       11000 05-MAY-06
AH301                05-MAY-06            62000            5000       10000 06-MAY-06
AH302                05-MAY-07            52000            6000        9000 06-MAY-07
AH303                05-JUN-07            42000            7000        8000 06-JUN-07
AH304                06-JUN-07            32000            8000        7000 07-JUN-07
AH305                06-JUN-08            22000            9000        6000 07-JUN-08
AH200                01-JAN-01            20000            2000       13000 02-JAN-02
AH201                01-JAN-02            30000            3000       23000 02-JAN-03

LOAN_PAYMENT_ID      PAYMENT_S PRINCIPAL_AMOUNT INTEREST_AMOUNT PAID_AMOUNT PAID_DATE
-------------------- --------- ---------------- --------------- ----------- ---------
AH202                02-FEB-03            40000            4000       33000 02-FEB-03
AH203                02-FEB-02           500000            5000       43000 03-FEB-03
AH204                02-FEB-04           600000            6000       53000 03-FEB-04
AH205                02-MAR-04           700000            7000       63000 03-MAR-04
AH206                03-MAR-04           800000            8000       73000 04-MAR-04
AH206                03-MAR-05           900000            9000       83000 04-MAR-05

17 rows selected.

SQL> create view v_loan_payment as select * from loan_payment where paid_amount>10000;

View created.

SQL> select * from v_loan_payment;

LOAN_PAYMENT_ID      PAYMENT_S PRINCIPAL_AMOUNT INTEREST_AMOUNT PAID_AMOUNT PAID_DATE
-------------------- --------- ---------------- --------------- ----------- ---------
AH207                04-APR-05            10000            1000       93000 04-APR-05
AH208                04-APR-05             9000            2000       13000 05-APR-05
AH209                04-APR-06             8000            3000       12000 05-APR-06
AH300                04-MAY-06             7200            4000       11000 05-MAY-06
AH200                01-JAN-01            20000            2000       13000 02-JAN-02
AH201                01-JAN-02            30000            3000       23000 02-JAN-03
AH202                02-FEB-03            40000            4000       33000 02-FEB-03
AH203                02-FEB-02           500000            5000       43000 03-FEB-03
AH204                02-FEB-04           600000            6000       53000 03-FEB-04
AH205                02-MAR-04           700000            7000       63000 03-MAR-04
AH206                03-MAR-04           800000            8000       73000 04-MAR-04

LOAN_PAYMENT_ID      PAYMENT_S PRINCIPAL_AMOUNT INTEREST_AMOUNT PAID_AMOUNT PAID_DATE
-------------------- --------- ---------------- --------------- ----------- ---------
AH206                03-MAR-05           900000            9000       83000 04-MAR-05

12 rows selected.

SQL> insert into v_loan_payment values('AH207','04-MAR-24',10000,9000,45000,'12-DEC-24');

1 row created.

Commit complete.
SQL> update v_loan_payment set interest_amount=1000 where principal_amount<10000;

3 rows updated.

Commit complete.
SQL> delete from v_loan_payment where paid_amount<15000;

4 rows deleted.

Commit complete.
SQL> select * from v_loan_payment;

LOAN_PAYMENT_ID      PAYMENT_S PRINCIPAL_AMOUNT INTEREST_AMOUNT PAID_AMOUNT PAID_DATE
-------------------- --------- ---------------- --------------- ----------- ---------
AH207                04-APR-05            10000            1000       93000 04-APR-05
AH201                01-JAN-02            30000            3000       23000 02-JAN-03
AH202                02-FEB-03            40000            4000       33000 02-FEB-03
AH203                02-FEB-02           500000            5000       43000 03-FEB-03
AH204                02-FEB-04           600000            6000       53000 03-FEB-04
AH205                02-MAR-04           700000            7000       63000 03-MAR-04
AH206                03-MAR-04           800000            8000       73000 04-MAR-04
AH206                03-MAR-05           900000            9000       83000 04-MAR-05
AH207                04-MAR-24            10000            9000       45000 12-DEC-24

9 rows selected.

SQL> select * from transaction;

TRANSACTION_ID       TRANSACTION_TYPE     TRANSACTI     AMOUNT
-------------------- -------------------- --------- ----------
A1000                deposit              05-JAN-06      60000
A1001                withdrawl            06-FEB-07      70000
A1002                transfer             07-MAR-08      50000
A1003                transfer             08-APR-09      80000
A1004                withdrawl            09-MAY-10      70000
A1005                deposit              10-JUN-11      70000
A1006                deposit              11-JUL-12      80000
A1007                withdrawl            12-AUG-13      25000
A1008                withdrawl            13-SEP-14      26000
A1009                withdrawl            14-OCT-15      27000
B2000                deposit              15-NOV-16      27000

TRANSACTION_ID       TRANSACTION_TYPE     TRANSACTI     AMOUNT
-------------------- -------------------- --------- ----------
B2001                transfer             16-DEC-17      26000
B2002                transfer             17-JAN-18      25000
B2003                withdrawl            18-FEB-19      80000
B2004                deposit              19-MAR-20      70000
B2005                transfer             20-APR-21      75000

16 rows selected.

SQL> create view v_transaction as select transaction_id,amount from transaction;

View created.

SQL> select * from v_transactio;
select * from v_transactio
              *
ERROR at line 1:
ORA-00942: table or view does not exist


SQL> select * from v_transaction;

TRANSACTION_ID           AMOUNT
-------------------- ----------
A1000                     60000
A1001                     70000
A1002                     50000
A1003                     80000
A1004                     70000
A1005                     70000
A1006                     80000
A1007                     25000
A1008                     26000
A1009                     27000
B2000                     27000

TRANSACTION_ID           AMOUNT
-------------------- ----------
B2001                     26000
B2002                     25000
B2003                     80000
B2004                     70000
B2005                     75000

16 rows selected.

SQL> insert into v_transaction values('B2006',10000);

1 row created.

Commit complete.
SQL> update v_transaction set amount=amount+5000;

17 rows updated.

Commit complete.
SQL> delete from v_transaction where amount<20000;

1 row deleted.

Commit complete.
SQL> select * from v_transaction;

TRANSACTION_ID           AMOUNT
-------------------- ----------
A1000                     65000
A1001                     75000
A1002                     55000
A1003                     85000
A1004                     75000
A1005                     75000
A1006                     85000
A1007                     30000
A1008                     31000
A1009                     32000
B2000                     32000

TRANSACTION_ID           AMOUNT
-------------------- ----------
B2001                     31000
B2002                     30000
B2003                     85000
B2004                     75000
B2005                     80000

16 rows selected.

SQL> commit;

Commit complete.
